,text,coarse_label,fine_label
877,What state in the U.S. has the most blacks ?,4,36
878,Why are electric cars less efficient in the northeast than in California ?,2,27
879,What was the occupation of Mandy Rice-Davies ?,3,30
880,What is the city in which Maurizio Pellegrin lives called ?,4,32
881,Who painted the Sistine Chapel ?,3,29
882,Name the various costumed personas of Dr. Henry Pym .,3,29
883,What breed of dog was the `` Little Rascals '' dog ?,1,2
884,What are the living conditions in Cuba ?,2,25
885,What color are school buses ?,1,4
886,What is the oldest website on the Internet ?,4,35
887,"What events happened January 26 , 1978 ?",1,8
888,What explorers followed Columbus to the Americas ?,3,29
889,Who is actress Goldie Hawn 's current actor boyfriend ?,3,29
890,Who banned Peter Rose from baseball for betting on games ?,3,29
891,What are the seven virtues ?,2,24
892,What other name were the `` Little Rascals '' known as ?,1,21
893,When was the San Francisco fire ?,5,39
894,What is a fear of food ?,1,7
895,"How many casinos are in Atlantic City , NJ ?",5,38
896,What year did the Vietnam War end ?,5,39
897,What are the names of Richard Nixon 's two daughters ?,3,29
898,What 's the word for broken glass or sharp rocks embedded in cement on top of a wall ?,1,23
899,What is the chromosome number of an elephant ?,5,38
900,What organization was founded by the Rev. Jerry Falwell ?,3,28
901,What 's the longest river in the world ?,4,35
902,Which soft drink does Madonna advertise for ?,1,9
903,What company is being bought by Yahoo and how much is the deal worth ?,3,28
904,When was Berlin 's Brandenburg gate erected ?,5,39
905,How many double-word-score spaces are there on a Scrabble Crossword Game board ?,5,38
906,What year did Germany sign its nonaggression pact with the Soviet Union ?,5,39
907,What mountain range is traversed by the highest railroad in the world ?,4,34
908,Why were the American soldiers in WWI called `` Doughboys '',2,27
909,Who was nicknamed The Little Corporal ?,3,29
910,How many CDs has Garth Brooks sold ?,5,38
911,Name the vessel used by the Atari Force in the DC comics .,1,22
912,Where are the leading medical groups specializing in lung diseases ?,4,35
913,"How can I find online spelling , and punctuation drills for my 6th grader ?",2,26
914,What 's the sacred river of India ?,4,35
915,What is Stefan Edberg 's native country ?,4,33
916,What is the only gland in humans that can regenerate itself ?,1,3
917,How many Gutenberg Bibles are there ?,5,38
918,Name the largest country in South America .,4,33
919,What astronomical phenomenon takes place in Jan. 1999 ?,1,8
920,What information can you get me on Fairground Park in St. Louis,2,25
921,What was American folk hero John Chapman 's nickname ?,3,29
922,What is the difference between a median and a mean ?,2,25
923,What was the top box office movie in April 1998 ?,1,5
924,What makes thunder ?,2,27
925,What author did photographer Yousuf Karsh call `` the shiest man I ever met '' ?,3,29
926,"Which is the largest clock , diameter wise , in Europe ?",1,13
927,What plant is rum made from ?,1,14
928,What country are Godiva chocolates from ?,4,33
929,"Name the poet of the poem which begins : I do not know much about gods ; but I think that the river Is a strong brown god-sullen , and untamed ?",3,29
930,Which condiment was once sold as a patent medicine ?,1,9
931,What U.S. state records the least rainfall ?,4,36
932,Why did the world enter a global depression in 1929 ?,2,27
933,"What was archy , and mehitabel ?",2,24
934,What Texas city got its name from the Spanish for `` yellow '' ?,4,32
935,What are the chemicals used in glowsticks ?,1,18
936,What country did the Nile River originate in ?,4,33
937,What color are tennis balls ?,1,4
938,What barroom judge called himself The Law West of the Pecos ?,3,29
939,What excuse did the NATO people give for hitting the Chinese embassy ?,2,25
940,Who was President of Costa Rica in 1994 ?,3,29
941,What sports event is Meyer Wolfsheim supposed to have fixed in The Great Gatsby ?,1,17
942,What country has the best defensive position in the board game Diplomacy ?,4,33
943,What two countries share the Khyber Pass ?,4,33
944,Who was chairman of the Senate select committee that tried to get to the bottom of Watergate ?,3,29
945,What is the origin of the surname of Braun ?,2,25
946,"What card game has variations called Canfield , Klondike and Spider ?",1,17
947,What is Australia Day ?,2,24
948,What mammal of North America is the world 's longest-lived for its size ?,1,2
949,What was the Chivington Massacre ?,2,24
950,"What actor starred in 1980 's Blue Lagoon , 1982 's The Pirate Movie and 1983 's A Night in Heaven ?",3,29
951,How many home runs did Lou Gehrig have during his career ?,5,38
952,In what city is the headquarters of Sinn Fein ?,4,32
953,Where can I find information on George Bush ?,4,35
954,Who is the voice of Miss Piggy ?,3,29
955,What is the dialogue circle in cartoons called ?,1,21
956,"What does the word camaro mean , from the GM car the Camaro ?",2,24
957,Who replaced Bert Parks as the host of The Miss America Pageant ?,3,29
958,How many boys play the game in Winslow Homer 's 1872 painting Snap the Whip ?,5,38
959,What is the AIM-54C Phoenix ?,2,24
960,When are sheep shorn ?,5,39
961,What sport is Chris Jogis a top player of ?,1,17
962,What 's the second-largest island in the world ?,4,35
963,What is the definition of low island ?,2,24
964,What century does Captain Video live in ?,5,39
965,What types of water pollution are there ?,1,13
966,How many astronauts manned each Project Mercury flight ?,5,38
967,What soft drink would provide me with the biggest intake of caffeine ?,1,9
968,What 's the name of a golf course in Myrtle Beach ?,1,13
969,What are some of the significant historical events of the 1990s ?,1,8
970,Name the only extant trilogy of classical Greek plays .,1,5
971,Where is Logan Airport ?,4,35
972,What is the difference between Neoclassical art and Romanticism art ?,2,25
973,Who was the first person inducted into the U.S. Swimming Hall of Fame ?,3,29
974,What golfer has been called Ohio Fats and Blobbo ?,3,29
975,Who murdered Leno and Rosemary LaBianca on August 1,3,29
976,What is the average cost for four years of medical school ?,5,41
977,What does God create in the first sentence of the Bible ?,1,13
978,Which of the following men was not married to Rita Hayworth ?,3,29
979,What is the current ticket fare from from Cairo to Barbados ?,5,41
980,What does NN O `` mean when used as a prefix in Irish surnames ?,0,1
981,How do you find oxidation numbers ?,2,26
982,What is the state nickname of Mississippi ?,4,36
983,"What is Black Hills , South Dakota most famous for ?",2,27
984,What 1966 boob tube bomb took astronauts back to prehistoric times ?,1,5
985,How many students attend the University of Massachusetts ?,5,38
986,"Who said , `` I shall return . '' during World War Two ?",3,29
987,What holidays are celebrated in Ireland ?,1,8
988,"Who portrayed Etta Place , companion to Butch Cassidey and the Sundance Kid ?",3,29
989,What are the Greek numerals ?,2,24
990,What 's the name of the temple that is located near the capital city of Laos ?,4,35
991,What is a fear of sleep ?,1,7
992,What auto race was Wilbur Reed the first to win three times ?,1,17
993,What are the most common breeding birds in the U.S. ?,1,2
994,"What was organized as a Confederate veterans ' social club in Pulaski , in Tennessee , in 1866 ?",1,8
995,How do you look up criminal records on the Internet ?,2,26
996,"Where is the actress , Marion Davies , buried ?",4,35
997,What is an example of an actual case of using the Fourteenth Amendment ?,2,25
998,Who was the Charlie perfume woman ?,3,29
999,Who portrayed `` Rosanne Rosanna-Dana '' on the television show `` Saturday Night Live '' ?,3,29
